{
  "$schema": "https://json-schema.org/draft/2020-12/schema",
  "$id": "https://unoarena/contracts/match-completed/v1",
  "title": "MatchCompleted",
  "description": "Published async contract on room.lifecycle.events (P7). Producer: room-gameplay, via outbox-relay. Consumer: tournament, whose whole saga turns on it — `advancingPlayers` is the room's verdict and the only thing that moves a round forward, so a producer-side change here stalls every bracket rather than degrading one number. Traces to docs/design/04-commands-events.md §4.1 and §3.2.2 (the Room owns the match because every game of it is the same people in the same room). The sample is generated by the producer's own test, not written by hand.",
  "type": "object",
  "additionalProperties": false,
  "required": ["type", "roomId", "sequenceNumber", "matchResults", "advancingPlayers", "at"],
  "properties": {
    "type": { "type": "string", "const": "MatchCompleted" },
    "roomId": { "type": "string", "format": "uuid" },
    "sequenceNumber": { "type": "integer", "minimum": 0 },
    "matchResults": {
      "type": "object",
      "additionalProperties": {
        "type": "object",
        "additionalProperties": false,
        "required": ["wins", "losses", "cardPoints"],
        "properties": {
          "wins": { "type": "integer", "minimum": 0 },
          "losses": { "type": "integer", "minimum": 0 },
          "cardPoints": { "type": "integer", "minimum": 0 }
        }
      }
    },
    "advancingPlayers": {
      "type": "array",
      "description": "Empty is a real answer: a room nobody was left in advances nobody, and the round still closes.",
      "items": { "type": "string" }
    },
    "at": { "type": "string", "format": "date-time" }
  }
}
